{
  "$schema": "./capability-ledger.schema.json",
  "schemaVersion": 1,
  "ledgerVersion": "2026-08-23.2",
  "cutoverUnits": [
    {
      "id": "network-capture",
      "description": "Request timing, protected context, headers, rules, classification, deduplication, and resource-state handoff.",
      "atomicCutover": true,
      "dependsOn": [],
      "dependencyMapping": "pending",
      "dispatchBoundaryRefs": [
        "electron/service/embeddedBrowserMainSupport.ts#initializeEmbeddedBrowserMainBridges",
        "electron/service/embeddedBrowserResourceBridge.ts#initializeEmbeddedBrowserResourceBridge"
      ]
    },
    {
      "id": "deep-search-runtime",
      "description": "Document-start Worker, fetch, XHR, JSON, TextDecoder, key, manifest, and page-action runtime bundle.",
      "atomicCutover": true,
      "dependsOn": [],
      "dependencyMapping": "pending",
      "dispatchBoundaryRefs": [
        "electron/service/embeddedBrowserResourceProbeScriptTemplate.ts#createEmbeddedBrowserResourceProbeScript",
        "electron/service/embeddedBrowserViewLifecycle.ts#installEmbeddedBrowserResourceProbe"
      ]
    },
    {
      "id": "mse-runtime",
      "description": "MediaSource capture, bounded page buffering, main spool, reset, finalize, and merge lifecycle.",
      "atomicCutover": true,
      "dependsOn": [],
      "dependencyMapping": "pending",
      "dispatchBoundaryRefs": [
        "electron/service/embeddedBrowserResourceProbeRuntimeHooks.ts#embeddedBrowserResourceProbeRuntimeHooksBody",
        "electron/service/embeddedBrowserMainController.ts#onProbePayload"
      ]
    },
    {
      "id": "hls-engine",
      "description": "HLS parse, plan, key, map, range, rendition, live, retry, preprocessing, and byte-output semantics.",
      "atomicCutover": true,
      "dependsOn": [],
      "dependencyMapping": "pending",
      "dispatchBoundaryRefs": [
        "src/features/embedded-browser/resources/services/embedded-browser-resource-manifest-actions.ts#loadEmbeddedBrowserHlsManifest",
        "electron/service/embeddedBrowserMainController.ts#downloadEmbeddedBrowserHlsPlanResource"
      ]
    },
    {
      "id": "dash-engine",
      "description": "DASH parse, plan, BaseURL, timeline, track, range, download, merge, and rejection semantics.",
      "atomicCutover": true,
      "dependsOn": [],
      "dependencyMapping": "pending",
      "dispatchBoundaryRefs": [
        "src/features/embedded-browser/resources/services/embedded-browser-resource-manifest-actions.ts#loadEmbeddedBrowserMpdManifest",
        "electron/service/embeddedBrowserMainController.ts#downloadEmbeddedBrowserMpdPlanResource"
      ]
    },
    {
      "id": "transfer-engine",
      "description": "Concurrent transfer, Range, retry, abort, ordered output, cancellation, memory budget, and task ownership.",
      "atomicCutover": true,
      "dependsOn": [],
      "dependencyMapping": "pending",
      "dispatchBoundaryRefs": [
        "electron/service/embeddedBrowserFragmentDownloader.ts#EmbeddedBrowserFragmentDownloader",
        "electron/service/embeddedBrowserMainController.ts#registerIpcHandlers"
      ]
    },
    {
      "id": "output-integration",
      "description": "Verified staged output, leases, ffmpeg, local save, library delivery, normal downloads, external tools, and workflow projection.",
      "atomicCutover": true,
      "dependsOn": [],
      "dependencyMapping": "pending",
      "dispatchBoundaryRefs": [
        "electron/service/embeddedBrowserMainController.ts#registerIpcHandlers",
        "src/features/tool-workspace/ToolWorkspaceMedia.tsx#ToolWorkspaceMedia"
      ]
    }
  ],
  "exclusionFamilies": [],
  "capabilities": [
    {
      "id": "capture.network-event-lifecycle",
      "origin": "cross-boundary",
      "boundary": "main.network-adapter",
      "cutoverUnitId": "network-capture",
      "additionalRiskTags": ["production-runtime", "cross-process", "long-task"],
      "upstreamSources": [
        { "path": "js/background.js", "anchor": "chrome.webRequest.onResponseStarted", "introducedBy": null, "blobHash": null }
      ],
      "localContractRefs": [
        { "path": "electron/service/embeddedBrowserResourceBridge.ts", "anchor": "initializeEmbeddedBrowserResourceBridge", "sourceHash": null }
      ],
      "auditedThrough": null,
      "oracleRelation": "platform-substitute",
      "disposition": "pending",
      "mapping": "unmapped",
      "requiredEvidence": {
        "beforeCutover": ["fixture", "behavior", "candidateIntegration", "candidateSoak"],
        "forCompletion": ["fixture", "behavior", "candidateIntegration", "candidateSoak", "activeIntegration", "activeSoak"]
      },
      "ownerRefs": {
        "targetProduction": ["electron/service/embedded-browser/capture/adapters/electron-network.ts#ElectronNetworkCaptureAdapter"],
        "candidate": [],
        "legacy": ["electron/service/embeddedBrowserResourceBridge.ts#initializeEmbeddedBrowserResourceBridge"]
      },
      "fixtures": ["network.first-byte-long-response", "network.context-terminal-cleanup"],
      "decision": null,
      "acceptedDifferences": [],
      "notes": "Seed gap: the current bridge records onCompleted rather than first byte and has no explicit cancellation/redirect closure contract. Local closure remains incomplete."
    },
    {
      "id": "capture.protected-request-context",
      "origin": "cross-boundary",
      "boundary": "main.context-vault",
      "cutoverUnitId": "network-capture",
      "additionalRiskTags": ["production-runtime", "cross-process", "credentials", "security-boundary"],
      "upstreamSources": [
        { "path": "js/background.js", "anchor": "G.requestHeaders", "introducedBy": null, "blobHash": null },
        { "path": "js/background.js", "anchor": "getRequestHeaders", "introducedBy": null, "blobHash": null }
      ],
      "localContractRefs": [
        { "path": "electron/service/embeddedBrowserResourceBridge.ts", "anchor": "requestContextsByRequestId", "sourceHash": null },
        { "path": "electron/service/embeddedBrowserResourceTypes.ts", "anchor": "EmbeddedBrowserCapturedRequestHeaders", "sourceHash": null }
      ],
      "auditedThrough": null,
      "oracleRelation": "platform-substitute",
      "disposition": "pending",
      "mapping": "unmapped",
      "requiredEvidence": {
        "beforeCutover": ["fixture", "behavior", "candidateIntegration", "candidateSoak"],
        "forCompletion": ["fixture", "behavior", "candidateIntegration", "candidateSoak", "activeIntegration", "activeSoak"]
      },
      "ownerRefs": {
        "targetProduction": ["electron/service/embedded-browser/capture/state/network-context-vault.ts#NetworkContextVault"],
        "candidate": [],
        "legacy": ["electron/service/embeddedBrowserResourceBridge.ts#requestContextsByRequestId"]
      },
      "fixtures": ["network.sensitive-header-projection", "network.context-ttl-purpose-binding"],
      "decision": null,
      "acceptedDifferences": [],
      "notes": "Seed gap: sensitive header values cross main, preload, renderer, plans, tools, and download commands; the current Map has no TTL or capacity budget."
    },
    {
      "id": "capture.request-url-helpers",
      "origin": "upstream-derived",
      "boundary": "capture.request-url-policy",
      "cutoverUnitId": "network-capture",
      "additionalRiskTags": ["production-runtime", "credentials", "security-boundary"],
      "upstreamSources": [
        { "path": "js/function.js", "anchor": "function setRequestHeaders(data = {}, callback = undefined)", "introducedBy": null, "blobHash": "sha256:f1876eeec0e22e25f2424054d0ea15510027a93237a3109d016f2e7cc16c59a0" },
        { "path": "js/function.js", "anchor": "function setHeaders(data, callBack, tabId = -1)", "introducedBy": null, "blobHash": "sha256:f1876eeec0e22e25f2424054d0ea15510027a93237a3109d016f2e7cc16c59a0" },
        { "path": "js/function.js", "anchor": "function isDamnUrl(url)", "introducedBy": null, "blobHash": "sha256:f1876eeec0e22e25f2424054d0ea15510027a93237a3109d016f2e7cc16c59a0" },
        { "path": "js/function.js", "anchor": "function isLockUrl(url)", "introducedBy": null, "blobHash": "sha256:f1876eeec0e22e25f2424054d0ea15510027a93237a3109d016f2e7cc16c59a0" }
      ],
      "localContractRefs": [],
      "auditedThrough": null,
      "oracleRelation": "exact",
      "disposition": "pending",
      "mapping": "unmapped",
      "requiredEvidence": {
        "beforeCutover": ["fixture", "behavior", "candidateIntegration", "candidateSoak"],
        "forCompletion": ["fixture", "behavior", "candidateIntegration", "candidateSoak", "activeIntegration", "activeSoak"]
      },
      "ownerRefs": {
        "targetProduction": ["electron/service/embedded-browser/cat-catch-port/network/request-url-helpers.ts#RequestUrlHelpers"],
        "candidate": [],
        "legacy": []
      },
      "fixtures": ["network.request-header-rule-scope", "network.url-filtering-parity"],
      "decision": null,
      "acceptedDifferences": [],
      "notes": "Seed only: Cat Catch request-header and URL filtering helpers are now anchored to the observed upstream bytes, but their dependency closure and OmniFlow mapping have not been audited."
    },
    {
      "id": "capture.rules-classification-deduplication",
      "origin": "cross-boundary",
      "boundary": "capture.network-core",
      "cutoverUnitId": "network-capture",
      "additionalRiskTags": ["production-runtime"],
      "upstreamSources": [
        { "path": "js/background.js", "anchor": "findMedia", "introducedBy": null, "blobHash": null },
        { "path": "js/init.js", "anchor": "Ext", "introducedBy": null, "blobHash": null }
      ],
      "localContractRefs": [
        { "path": "electron/service/embeddedBrowserResourceCaptureRules.ts", "anchor": "evaluateEmbeddedBrowserResourceCapture", "sourceHash": null },